{
  "schema_version": "1.0",
  "id": "evt_0198f3c1-4a20-7c3d-8f11-2b6d5e0a91c4",
  "type": "alert.created",
  "created_at": "2026-08-03T03:00:12Z",
  "sandbox": false,
  "data": {
    "alert_id": "alt_0198f3c1-4a21-7a0e-9b52-77c1d3e84f60",
    "watchlist_id": "wat_0198f3c0-1b7e-7d44-a913-5c2f9e60b8a1",
    "change_type": "COMMENCEMENT",
    "effective_date": "2026-09-01",
    "affected_research_record_ids": ["rec_0198f3c1-4a22-7e15-8c73-4de29b501fa6"]
  }
}
